[
  {"id": "card-001", "courseId": "course-psych-101", "topicId": "topic-memory", "prompt": "What is working memory?", "answer": "A limited-capacity system for temporary storage and manipulation of information."},
  {"id": "card-002", "courseId": "course-psych-101", "topicId": "topic-memory", "prompt": "Name one component of Baddeley's model.", "answer": "Phonological loop."},
  {"id": "card-003", "courseId": "course-psych-101", "topicId": "topic-conditioning", "prompt": "Who is associated with classical conditioning?", "answer": "Ivan Pavlov."},
  {"id": "card-004", "courseId": "course-psych-101", "topicId": "topic-conditioning", "prompt": "What is negative reinforcement?", "answer": "Removing an aversive stimulus to increase behavior."},
  {"id": "card-005", "courseId": "course-bio-220", "topicId": "topic-cell-biology", "prompt": "What is the function of the mitochondrion?", "answer": "ATP production through cellular respiration."},
  {"id": "card-006", "courseId": "course-bio-220", "topicId": "topic-cell-biology", "prompt": "Which organelle modifies proteins?", "answer": "Golgi apparatus."},
  {"id": "card-007", "courseId": "course-psych-101", "topicId": "topic-memory", "prompt": "What improves long-term retention?", "answer": "Spaced repetition."},
  {"id": "card-008", "courseId": "course-psych-101", "topicId": "topic-conditioning", "prompt": "Define extinction in conditioning.", "answer": "The weakening of a conditioned response when reinforcement stops."}
]
